{
  "catalog_version": 2,
  "base_id": "wr_heroine",
  "geometry_status": "reviewed_rig_preserving_options",
  "categories": {
    "face": {
      "label": "Face",
      "options": [
        {
          "id": "default",
          "label": "Original face"
        },
        {
          "id": "soft_cheeks",
          "label": "Softer cheeks"
        }
      ]
    },
    "hair": {
      "label": "Hair",
      "options": [
        {
          "id": "chestnut_layers",
          "label": "Layered shoulder length"
        },
        {
          "id": "short_layers",
          "label": "Short tapered layers"
        }
      ]
    },
    "skin": {
      "label": "Skin",
      "options": [
        {
          "id": "default_freckled",
          "label": "Original freckles"
        }
      ]
    },
    "body": {
      "label": "Body",
      "options": [
        {
          "id": "default",
          "label": "Original silhouette"
        },
        {
          "id": "subtle_shape",
          "label": "Subtle silhouette"
        }
      ]
    }
  },
  "tints": {
    "skin": [
      "#FFFFFF",
      "#E8CDBB",
      "#C49A80",
      "#967665",
      "#68544C"
    ],
    "hair": [
      "#FFFFFF",
      "#C8A06A",
      "#845A46",
      "#3D3532",
      "#A3A3A3"
    ],
    "eyes": [
      "#FFFFFF",
      "#82A8BF",
      "#8BA67A",
      "#AF8C63"
    ],
    "cloth": [
      "#FFFFFF",
      "#8BA1C9",
      "#688873",
      "#B28A91",
      "#5A5761"
    ],
    "leather": [
      "#FFFFFF",
      "#AA805F",
      "#64554E",
      "#3D3C3B"
    ]
  },
  "review_note": "Human approved shown options on2026-10-18: Approve these options. Runtime keeps existing16bones/rests/animations and applies reviewed surface changes. Original profile and geometry remain default; invalid-black denim atlas material bug is repaired non-destructively for all profiles."
}
